title,gemini_text,gemini_sentences,annotation,gemini_text_samples
Khởi nghĩa Hai Bà Trưng,"Khởi nghĩa Hai Bà Trưng là một cuộc khởi nghĩa chống quân xâm lược nhà Hán của người Việt, do hai chị em Trưng Trắc và Trưng Nhị lãnh đạo vào năm 40 sau Công nguyên. Cuộc khởi nghĩa bùng nổ tại Mê Linh (nay thuộc Hà Nội), nhanh chóng lan rộng ra khắp các vùng đất thuộc Giao Chỉ, đánh bại quân Hán và giành lại độc lập cho đất nước. Hai Bà Trưng được tôn vinh là những nữ tướng anh hùng, biểu tượng cho tinh thần yêu nước, bất khuất của dân tộc Việt Nam. Cuộc khởi nghĩa tuy chỉ kéo dài 3 năm nhưng đã để lại dấu ấn lịch sử to lớn, khẳng định ý chí tự cường và tinh thần kiên cường của dân tộc Việt Nam. 
","['Khởi nghĩa Hai Bà Trưng là một cuộc khởi nghĩa chống quân xâm lược nhà Hán của người Việt, do hai chị em Trưng Trắc và Trưng Nhị lãnh đạo vào năm 40 sau Công nguyên.', 'Cuộc khởi nghĩa bùng nổ tại Mê Linh (nay thuộc Hà Nội), nhanh chóng lan rộng ra khắp các vùng đất thuộc Giao Chỉ, đánh bại quân Hán và giành lại độc lập cho đất nước.', 'Hai Bà Trưng được tôn vinh là những nữ tướng anh hùng, biểu tượng cho tinh thần yêu nước, bất khuất của dân tộc Việt Nam.', 'Cuộc khởi nghĩa tuy chỉ kéo dài 3 năm nhưng đã để lại dấu ấn lịch sử to lớn, khẳng định ý chí tự cường và tinh thần kiên cường của dân tộc Việt Nam.']","['accurate', 'minor_inaccurate', 'accurate', 'accurate']","['Khởi nghĩa Hai Bà Trưng là một cuộc khởi nghĩa của người Việt chống lại ách đô hộ của nhà Hán vào năm 40 sau công nguyên, do hai chị em Trưng Trắc và Trưng Nhị lãnh đạo. Cuộc khởi nghĩa bùng nổ tại Mê Linh, sau khi chồng của Trưng Trắc là Thi Sách bị thái thú Tô Định giết hại. Hai Bà Trưng tập hợp lực lượng, nhanh chóng giành được thắng lợi, đánh đuổi quân Hán ra khỏi đất nước, lập ra nước Vạn Xuân với Trưng Trắc lên làm vua. Nước Vạn Xuân tồn tại trong 3 năm, sau đó bị nhà Hán đàn áp. Khởi nghĩa Hai Bà Trưng là một biểu hiện của tinh thần yêu nước, ý chí độc lập tự cường của dân tộc Việt Nam. Nó để lại cho hậu thế một truyền thống hào hùng, bất khuất, một tấm gương sáng về lòng dũng cảm, sự mưu lược và tinh thần bất khuất chống giặc ngoại xâm của dân tộc. \n', 'Khởi nghĩa Hai Bà Trưng là một cuộc khởi nghĩa tiêu biểu trong lịch sử dân tộc Việt Nam, diễn ra vào năm 40 sau công nguyên. Dưới sự lãnh đạo của hai Bà Trưng Trắc và Trưng Nhị, người dân Giao Chỉ đã đứng lên chống lại ách đô hộ của nhà Hán, đánh đuổi quân xâm lược và giành lại độc lập cho đất nước. Cuộc khởi nghĩa đã thể hiện tinh thần yêu nước, ý chí kiên cường bất khuất của dân tộc Việt Nam, góp phần khẳng định chủ quyền và độc lập của quốc gia. Sau ba năm giành được độc lập, cuộc khởi nghĩa bị đàn áp bởi quân đội nhà Hán. Tuy nhiên, tinh thần của Hai Bà Trưng và cuộc khởi nghĩa đã trở thành biểu tượng cho tinh thần bất khuất, yêu nước của dân tộc Việt Nam, truyền cảm hứng cho các thế hệ sau này trong cuộc đấu tranh giành độc lập, tự do. \n', 'Khởi nghĩa Hai Bà Trưng là một cuộc khởi nghĩa chống quân xâm lược nhà Hán do Hai Bà Trưng, tức Trưng Trắc và Trưng Nhị, lãnh đạo vào năm 40 sau Công nguyên. Cuộc khởi nghĩa diễn ra ở vùng châu Giao (bao gồm miền Bắc Việt Nam và một phần Lào, Trung Quốc ngày nay), nơi người dân chịu sự cai trị hà khắc và bóc lột tàn bạo của nhà Hán. Hai Bà Trưng đã huy động được lực lượng đông đảo người dân, trang bị vũ khí thô sơ nhưng đầy tinh thần chiến đấu, đánh bại quân Hán và giành lại độc lập cho đất nước. Sau chiến thắng, Trưng Trắc được tôn làm vua, lập ra chính quyền tự chủ. Tuy nhiên, cuộc khởi nghĩa chỉ tồn tại được 3 năm trước khi bị quân Hán đàn áp. Mặc dù thất bại, Khởi nghĩa Hai Bà Trưng đã thể hiện tinh thần yêu nước và ý chí độc lập của dân tộc Việt Nam, góp phần vào việc khẳng định chủ quyền quốc gia và truyền cảm hứng cho các cuộc khởi nghĩa sau này. \n', 'Khởi nghĩa Hai Bà Trưng là một cuộc khởi nghĩa chống quân xâm lược nhà Hán của người Việt vào năm 40 sau công nguyên, do hai chị em Trưng Trắc và Trưng Nhị lãnh đạo. Cuộc khởi nghĩa bùng nổ tại Mê Linh (nay thuộc Vĩnh Phúc), nhanh chóng lan rộng khắp 65 thành trì, đánh đuổi được quân Hán khỏi đất nước. Hai Bà Trưng được tôn vinh là những nữ tướng tài ba, dũng cảm, là biểu tượng của tinh thần yêu nước và đấu tranh giành độc lập của dân tộc Việt Nam. Cuộc khởi nghĩa tuy bị đàn áp sau 3 năm nhưng để lại dấu ấn lịch sử to lớn, khẳng định ý chí độc lập, tự chủ của dân tộc Việt Nam và thể hiện vai trò của phụ nữ trong lịch sử dân tộc. \n', 'Khởi nghĩa Hai Bà Trưng (40 sau Công Nguyên) là một cuộc khởi nghĩa chống ách đô hộ của nhà Hán do Hai Bà Trưng, tức Trưng Trắc và Trưng Nhị lãnh đạo. Nổi lên từ huyện Mê Linh (nay thuộc Hà Nội), cuộc khởi nghĩa nhanh chóng lan rộng ra khắp 65 thành trì của Giao Chỉ, đánh bại quân Hán và giành độc lập cho đất nước trong 3 năm. Tuy nhiên, lực lượng của Hai Bà Trưng yếu thế hơn so với quân Hán, cuối cùng cuộc khởi nghĩa bị dập tắt. Khởi nghĩa Hai Bà Trưng đánh dấu một thời kỳ oai hùng, thể hiện ý chí kiên cường, bất khuất của dân tộc Việt Nam trong cuộc đấu tranh giành độc lập. \n', 'Khởi nghĩa Hai Bà Trưng là một cuộc khởi nghĩa chống ngoại xâm của nhân dân ta do Hai Bà Trưng lãnh đạo vào năm 40 sau công nguyên.  Nổi lên từ vùng Mê Linh (nay thuộc Vĩnh Phúc), cuộc khởi nghĩa đã đánh bại ách đô hộ của nhà Hán, giành lại độc lập cho đất nước.  Hai Bà Trưng được tôn vinh là những vị nữ tướng anh hùng, biểu tượng cho tinh thần yêu nước, bất khuất, quật cường của dân tộc Việt Nam.  Khởi nghĩa Hai Bà Trưng là một trang sử hào hùng, góp phần khẳng định ý chí độc lập, tự chủ của dân tộc, đồng thời tạo nên truyền thống yêu nước, chống ngoại xâm cho các thế hệ mai sau.\n', 'Khởi nghĩa Hai Bà Trưng là cuộc khởi nghĩa của nhân dân ta chống lại ách đô hộ của nhà Hán vào năm 40 sau Công nguyên, do hai Bà Trưng là Trưng Trắc và Trưng Nhị lãnh đạo.  Nổi tiếng bởi lòng dũng cảm và tinh thần yêu nước, hai Bà Trưng đã tập hợp lực lượng, xây dựng quân đội, đánh đuổi quân Hán, giành lại độc lập cho đất nước. Khởi nghĩa thắng lợi, lập nên nước Vạn Xuân với Trưng Trắc lên làm vua, kéo dài được 3 năm. Cuộc khởi nghĩa thể hiện ý chí kiên cường bất khuất của dân tộc Việt Nam trong cuộc đấu tranh giành độc lập tự do. Mặc dù kết thúc thất bại, nhưng Khởi nghĩa Hai Bà Trưng đã để lại cho thế hệ sau tinh thần yêu nước, ý chí quật cường, và hình tượng của hai Bà Trưng trở thành biểu tượng bất tử cho tinh thần yêu nước của dân tộc Việt Nam.\n', 'Khởi nghĩa Hai Bà Trưng là một cuộc khởi nghĩa của người Việt chống lại ách đô hộ của nhà Hán vào năm 40 sau Công Nguyên. Hai Bà Trưng, tức Trưng Trắc và Trưng Nhị, là những nữ tướng dũng cảm, dẫn dắt quân khởi nghĩa đánh đuổi quân Hán khỏi đất nước. Cuộc khởi nghĩa đã thành công, giành lại độc lập cho dân tộc trong 3 năm, tạo nên một thời kỳ vàng son trong lịch sử dân tộc. Khởi nghĩa Hai Bà Trưng là biểu tượng của tinh thần yêu nước, kiên cường, bất khuất của dân tộc Việt Nam, truyền cảm hứng cho các thế hệ sau này trong cuộc đấu tranh bảo vệ đất nước.  \n', 'Khởi nghĩa Hai Bà Trưng là một cuộc khởi nghĩa chống lại ách đô hộ của nhà Hán, do Hai Bà Trưng lãnh đạo, nổ ra vào năm 40 sau Công nguyên. Cuộc khởi nghĩa bùng nổ tại Mê Linh (nay thuộc Hà Nội), với sự tham gia của đông đảo người dân, các tướng lĩnh tài ba như Lê Chân, Thi Sách,... Quân khởi nghĩa nhanh chóng giành được thắng lợi, đánh đuổi quân Hán ra khỏi đất nước, lập nên nước Vạn Xuân, với Hai Bà Trưng lên ngôi vua.  Cuộc khởi nghĩa thể hiện tinh thần yêu nước, ý chí độc lập, sức mạnh đoàn kết của dân tộc,  góp phần dựng nên truyền thống lịch sử hào hùng của dân tộc Việt Nam. \n', 'Khởi nghĩa Hai Bà Trưng, diễn ra vào năm 40 sau Công nguyên, là một cuộc khởi nghĩa của nhân dân Giao Chỉ chống lại ách đô hộ của nhà Hán. Dưới sự lãnh đạo của Hai Bà Trưng, người con gái anh hùng của đất Việt, nghĩa quân đã đánh đuổi quân Hán ra khỏi nước ta, giành lại độc lập cho dân tộc. Cuộc khởi nghĩa đã thể hiện tinh thần yêu nước, ý chí kiên cường và lòng dũng cảm của người dân Việt Nam. Mặc dù chỉ tồn tại trong thời gian ngắn, Khởi nghĩa Hai Bà Trưng đã để lại dấu ấn lịch sử to lớn, khơi dậy tinh thần yêu nước, tự hào dân tộc của các thế hệ mai sau. \n', 'Khởi nghĩa Hai Bà Trưng là một trong những trang sử hào hùng nhất của dân tộc Việt Nam. Năm 40, dưới ách đô hộ tàn bạo của nhà Hán, Hai Bà Trưng, cùng với tinh thần yêu nước và ý chí quyết tâm giành độc lập, đã lãnh đạo nhân dân khởi nghĩa. Cuộc khởi nghĩa bùng nổ ở Mê Linh (Hà Nội), nhanh chóng lan rộng ra khắp các vùng thuộc 6 quận của Giao Chỉ. Quân khởi nghĩa đã giành được nhiều thắng lợi vang dội, đánh đuổi quân Hán ra khỏi nước ta, lập nên chính quyền tự chủ, với Hai Bà Trưng làm vua. Khởi nghĩa Hai Bà Trưng đã khẳng định ý chí và sức mạnh của dân tộc Việt Nam, góp phần hun đúc tinh thần yêu nước, chống ngoại xâm cho các thế hệ mai sau. \n', 'Khởi nghĩa Hai Bà Trưng (40 sau Công Nguyên) là một cuộc nổi dậy vĩ đại của nhân dân ta chống lại ách đô hộ của nhà Hán.  Dưới sự lãnh đạo của Hai Bà Trưng Trắc và Trưng Nhị, cuộc khởi nghĩa bùng nổ từ huyện Mê Linh (nay thuộc Hà Nội) và nhanh chóng lan rộng khắp 65 thành trì của 13 quận thuộc Giao Chỉ.  Với tinh thần yêu nước và lòng dũng cảm phi thường, Hai Bà Trưng đã đánh bại quân Hán, giành lại độc lập cho đất nước.  Khởi nghĩa Hai Bà Trưng là minh chứng cho sức mạnh của tinh thần đoàn kết, ý chí kiên cường của dân tộc Việt Nam.  Dù chỉ kéo dài được 3 năm, cuộc khởi nghĩa đã để lại dấu ấn lịch sử sâu sắc, khẳng định tinh thần bất khuất của dân tộc Việt Nam trong cuộc đấu tranh giành độc lập, tự do. \n', 'Khởi nghĩa Hai Bà Trưng là một cuộc khởi nghĩa của người Việt chống lại ách đô hộ của nhà Hán vào năm 40 sau Công nguyên. Do hai chị em Trưng Trắc và Trưng Nhị lãnh đạo, cuộc khởi nghĩa đã nhanh chóng lan rộng khắp 65 huyện thuộc 3 quận Giao Chỉ, Cửu Chân và Nhật Nam, lật đổ chính quyền đô hộ và lập ra chính quyền tự chủ với Trưng Trắc lên làm vua. Khởi nghĩa Hai Bà Trưng đã thể hiện tinh thần yêu nước, ý chí độc lập và sức mạnh phi thường của dân tộc Việt Nam, đánh dấu một trang sử hào hùng của dân tộc, khẳng định vị thế của người phụ nữ Việt Nam trong lịch sử. Dù sau đó bị đàn áp, cuộc khởi nghĩa đã để lại ý nghĩa to lớn, hun đúc tinh thần bất khuất cho các thế hệ mai sau trong công cuộc đấu tranh giành độc lập dân tộc.\n', 'Khởi nghĩa Hai Bà Trưng, diễn ra vào năm 40 sau Công nguyên, là một cuộc khởi nghĩa oai hùng của người Việt chống lại ách đô hộ của nhà Hán. Do hai chị em Trưng Trắc và Trưng Nhị lãnh đạo, nghĩa quân đã đánh bại quân Hán, giành lại độc lập cho đất nước, lập ra nhà nước tự chủ, với Trưng Trắc lên ngôi vua. Cuộc khởi nghĩa là biểu hiện hào hùng của ý chí độc lập tự chủ của dân tộc Việt Nam, khẳng định sức mạnh và tinh thần bất khuất của người phụ nữ Việt Nam. Khởi nghĩa Hai Bà Trưng đã trở thành một trang sử hào hùng, là niềm tự hào của dân tộc Việt Nam và được lưu truyền qua bao thế hệ. \n', 'Khởi nghĩa Hai Bà Trưng là một cuộc khởi nghĩa chống ngoại xâm của nhân dân Việt Nam, diễn ra vào năm 40 sau Công Nguyên. Do hai chị em Trưng Trắc và Trưng Nhị lãnh đạo, cuộc khởi nghĩa đã đánh bại chính quyền đô hộ của nhà Hán, giành lại độc lập cho đất nước.  Khởi nghĩa Hai Bà Trưng là một biểu hiện của tinh thần yêu nước, bất khuất của dân tộc Việt Nam, thể hiện ý chí giành độc lập và bảo vệ Tổ quốc. Cuộc khởi nghĩa cũng để lại nhiều bài học quý báu về tinh thần đoàn kết, dũng cảm, và sự lãnh đạo sáng suốt. \n', 'Khởi nghĩa Hai Bà Trưng là một trong những trang sử hào hùng của dân tộc Việt Nam. Diễn ra vào năm 40 sau công nguyên, cuộc khởi nghĩa do hai chị em Trưng Trắc và Trưng Nhị lãnh đạo đã đánh bại ách đô hộ của nhà Hán, giành lại độc lập cho đất nước. Với tinh thần yêu nước, lòng dũng cảm và chiến thuật tài tình, Hai Bà Trưng đã tập hợp được đông đảo nhân dân tham gia cuộc khởi nghĩa, đánh bại quân Hán ở nhiều trận đánh quan trọng. Tuy nhiên, do lực lượng chênh lệch, khởi nghĩa bị đàn áp sau 3 năm.  Mặc dù thất bại, nhưng Khởi nghĩa Hai Bà Trưng đã thể hiện ý chí kiên cường và lòng yêu nước bất khuất của dân tộc Việt Nam, đồng thời để lại dấu ấn sâu đậm trong lịch sử và văn hóa dân tộc. \n', 'Khởi nghĩa Hai Bà Trưng là một cuộc khởi nghĩa chống ngoại xâm của nhân dân ta vào năm 40 sau công nguyên, do hai chị em Trưng Trắc và Trưng Nhị lãnh đạo. Hai Bà Trưng là những nữ tướng tài ba, dũng cảm, đã tập hợp lực lượng nghĩa quân, đánh đuổi quân Hán xâm lược, giành lại độc lập cho đất nước. Khởi nghĩa Hai Bà Trưng đã thể hiện tinh thần yêu nước, ý chí kiên cường và lòng tự hào dân tộc của người Việt. Cuộc khởi nghĩa thất bại sau 3 năm, nhưng đã để lại dấu ấn sâu sắc trong lịch sử, khẳng định truyền thống bất khuất, kiên cường của dân tộc Việt Nam. \n', 'Khởi nghĩa Hai Bà Trưng, diễn ra vào năm 40 sau Công nguyên, là một cuộc khởi nghĩa chống ngoại xâm của người Việt do Hai Bà Trưng lãnh đạo.  Cuộc khởi nghĩa bùng nổ khi chính quyền nhà Hán áp đặt ách đô hộ tàn bạo lên người Việt.  Hai Bà Trưng, với tinh thần yêu nước và lòng căm thù giặc sâu sắc, đã tập hợp lực lượng, dựng cờ khởi nghĩa, đánh đuổi quân Hán khỏi đất nước. Cuộc khởi nghĩa giành thắng lợi, đánh dấu sự phục hồi độc lập của dân tộc Việt.  Tuy nhiên, do lực lượng còn hạn chế, cuộc khởi nghĩa bị nhà Hán đàn áp sau 3 năm.  Mặc dù thất bại, Khởi nghĩa Hai Bà Trưng là biểu tượng bất khuất, kiên cường của dân tộc Việt, góp phần khơi dậy lòng yêu nước và ý chí tự cường của các thế hệ mai sau. \n', 'Khởi nghĩa Hai Bà Trưng là một cuộc khởi nghĩa chống ngoại xâm của người Việt, do hai Bà Trưng Trắc và Trưng Nhị lãnh đạo, diễn ra vào năm 40 sau Công nguyên. Cuộc khởi nghĩa đã đánh bại ách đô hộ của nhà Hán, giành lại độc lập cho đất nước, mở ra một thời kỳ tự chủ ngắn ngủi cho dân tộc. Hai Bà Trưng được tôn vinh là những vị nữ anh hùng dân tộc, biểu tượng cho tinh thần bất khuất, kiên cường của dân tộc Việt Nam. Cuộc khởi nghĩa còn để lại nhiều bài học quý báu về lòng yêu nước, tinh thần đoàn kết, ý chí đấu tranh giành độc lập cho dân tộc. \n', 'Khởi nghĩa Hai Bà Trưng (40 sau Công Nguyên) là một cuộc khởi nghĩa chống ngoại xâm của nhân dân ta, do Hai Bà Trưng lãnh đạo. Nổi lên từ huyện Mê Linh (nay thuộc Hà Nội), khởi nghĩa nhanh chóng lan rộng ra khắp các vùng thuộc Giao Chỉ, đánh đuổi được chính quyền đô hộ nhà Hán, giành lại độc lập cho đất nước. Hai Bà Trưng lên ngôi vua, xây dựng chính quyền tự chủ, khẳng định ý chí quyết tâm giành độc lập của dân tộc Việt Nam. Cuộc khởi nghĩa thất bại sau 3 năm, nhưng nó đã thể hiện tinh thần bất khuất, yêu nước và ý chí giành độc lập của dân tộc Việt Nam, để lại bài học lịch sử to lớn về lòng yêu nước, tinh thần đoàn kết, chống ngoại xâm cho các thế hệ mai sau. \n']"
